{"operation":"DOCUMENT_CONVERSION","inputArtifactId":"00000000-0000-4000-8000-000000000101","outputs":[{"artifactId":"00000000-0000-4000-8000-000000000501","artifactClass":"STAGING","role":"MARKDOWN","key":"staging/00000000-0000-4000-8000-000000000301/00000000-0000-4000-8000-000000000401/content.md","mediaType":"text/markdown","byteLength":512,"checksumAlgorithm":"SHA256","checksum":"cccccccccccccccccccccccccccccccccccccccccccccccccccccccccccccccc","immutable":false,"createdAt":"2026-07-15T00:00:02.000Z"}],"pageCount":2,"convertedPageCount":2,"detectedLanguages":["ar","en"],"textDirection":"MIXED","ocrUsed":false,"tableCount":1,"imageCount":0,"providerNativeOutput":null,"markdownOutput":{"artifactId":"00000000-0000-4000-8000-000000000501","artifactClass":"STAGING","role":"MARKDOWN","key":"staging/00000000-0000-4000-8000-000000000301/00000000-0000-4000-8000-000000000401/content.md","mediaType":"text/markdown","byteLength":512,"checksumAlgorithm":"SHA256","checksum":"cccccccccccccccccccccccccccccccccccccccccccccccccccccccccccccccc","immutable":false,"createdAt":"2026-07-15T00:00:02.000Z"},"pageManifestOutput":{"artifactId":"00000000-0000-4000-8000-000000000502","artifactClass":"STAGING","role":"MANIFEST","key":"staging/00000000-0000-4000-8000-000000000301/00000000-0000-4000-8000-000000000401/pages.json","mediaType":"application/json","byteLength":128,"checksumAlgorithm":"SHA256","checksum":"dddddddddddddddddddddddddddddddddddddddddddddddddddddddddddddddd","immutable":false,"createdAt":"2026-07-15T00:00:02.000Z"},"warnings":[],"metrics":{"wallTimeMs":2000,"peakMemoryBytes":1000000,"bytesRead":1024,"bytesWritten":640},"derivation":{"inputChecksums":["aaaaaaaaaaaaaaaaaaaaaaaaaaaaaaaaaaaaaaaaaaaaaaaaaaaaaaaaaaaaaaaa"],"provider":{"providerId":"reference.document","providerVersion":"1.0.0","adapterVersion":"1.0.0"},"optionsDigest":"eeeeeeeeeeeeeeeeeeeeeeeeeeeeeeeeeeeeeeeeeeeeeeeeeeeeeeeeeeeeeeee","modelDigests":[]}}
